start_time,end_time,name,content
0,2,Mae,this is interesting right here (**)
1,2,Adhir,yea
2,3,Jeans,Yea this is really cool 
2,4,Blake,oh yo yo yo look
5,8,Mae,this is..this is cool right here..these instruments are pretty amazing 
7,9,Adhir,Oh MY GOD.. Hanks D 28!
11,14,Blake,then there's like..  this is where bill monroe's mandolin is 
12,15,Lily,(***)
13,14,Jeans,K Blake
32,35,Lily,wow...what a guitar
37,40,Lily,jeans it has kinda scratches like yours
39,40,Mae,it does
40,43,Jeans,yep... right.. by the pick guard (**)
42,45,Mae,see there's like one his mom did right there (**)
46,47,Jeans,I DOUBT it 
47,50,Mae,david keeps mentioning that
50,52,Jeans,LOOK at this this is the coolest guitar in the world...(**)
53,57,Lily,awwww.. he's a key member of the Bluegrass Boys (***)
54,55,Jeans,Lester! 
60,63,Mae,seems kinda crazy to me that that instruments just sittin there (1
63,64,Adhir,mhm
63,64,Lily,aww it had his name on it
64,68,Mae,you know in some ways.. you wish someone (*) really awesome was using it
68,70,Blake,Adhir look.. Lester Flatt's guitar (*)
70,78,Adhir,well like Hank Williams..It looks like Hank Williams Jr. just donated .. gave it here as I imagine it would be so hard for him to part with his dads..guitar.. cuz he could be playing it
70,71,Jeans,it's so cool
72,74,Lily,one of the greatest rhythm instruments ever made (***)
73,74,Blake,Lester Flatts
74,76,Jeans,it's just a beautiful guitar..1950.. oh its 1950!
78,79,Mae,to donate it here you mean? 
79,82,Adhir,well yeah I mean maybe he didn't donate it but..it's just
80,85,Lily,fret and gluing his business card inside the sound hole (***)...yea 
81,82,Blake,Adhir!
82,83,Mae,mm
83,84,Blake,Lester Flatts guitar
84,85,Adhir,which one?
85,86,Blake,Lester Flatts
86,87,Adhir,oh wow
87,95,Mae,"I know, I don't know you wonder how he felt about that..maybe he felt like it was the best place for it (1"
88,91,Lily,there it is! it's in there up and to the left 
90,93,Jeans,wait uhh.. oh my god.. oh my god yep (1
96,97,Jeans,Earl Scruggs ban (1
100,102,Lily,what a piece of work he was
103,107,Blake,Look earl scruggs banjo!...everything's here
110,111,Lily,Blake look!
111,112,Jeans,yea...
113,114,Blake,hmhm..I've seen this all
115,116,Blake,and then Bill Monroe’s Mandolin!
115,116,Jeans,look it BILL MONROEE!
116,117,Lily,"OH MY GOD, "
118,121,Blake,LOOK it LOOKS PERFECT (**)
118,128,Jeans,this mandolin (**)  a thief broke into his house and smashed it and...Gibson put it back together for him with hundreds of little shards (*) of wood that were in the.. of the mandolin (**) 
127,129,Blake,read it! read it! (**) (***)
137,138,Lily,Lloyd Loar (***) 
138,139,Jeans,One hundred fifty
139,142,Mae,OK this is amazing...THAT is THE ONE (**) that was repaired
141,144,Lily,have you ever seen a more beautiful instrument? 
144,145,Jeans,NO! 
144,145,Lily,It's gorgeous!
144,145,Mae,NO! It's AWESOME!
145,147,Jeans,tha..this (**) is the most beautiful instrument in the whole 
147,150,Jeans,museum it's cooler than the mm 
147,150,Mae,I know!  It just blows your mind put it all back together 
150,153,Lily,spotted in a florida BARBERshop window (***)
155,162,Jeans,Lloyd Loar...ohs us?  Yea this is (**) silent July by Gibson's legendary acoustic engineer Lloyd Loar (***)
163,164,Mae,Yea it's awesome..I know
164,166,Lily,Oh my god that is so sweeeet
165,170,Mae,and it was put back together (*) from 150 pieces it's just stunning
168,170,Lily,GOSH! (2
169,170,Blake,and then Maybelle Carter (2
169,170,Jeans,and Maybelle Carter's guitar
173,175,Blake,and then Jimi Rogers' guitar
174,176,Mae,this is awesome to.. awesome
175,176,Jeans,for two hundred seventy five (***)
186,187,Jeans,where's Adhir!? 
188,192,Mae,look (**) it's interesting that big thing like why were they using that (*)  that's like a guard
193,195,Jeans,It's pickguard.. different kind
194,195,Mae,sticks out
195,196,Jeans,"more like a mandolin,"
196,198,Lily,the F.. the F style guitars have those more
198,199,Jeans,Yep
199,201,Blake,Adhir is still on Hank Williams 
200,202,Lily,yea he is going a little slowly
202,204,Mae,he's very emotional about it.. I love him
204,205,Jeans,Look at this..Look at THIS
206,207,Blake,Jimmie Rogers!
208,209,Jeans,guys check it
209,215,Mae,I was trying to analyze whether it was haaard for Hank Williams Jr.. to give it to the museum or whether he wanted it here
215,216,Jeans,who!? 
216,217,Jeans,who..who..who did that? 
216,219,Mae,like I can real.. was wondering those same questions who
220,226,Mae,well you wonder like.. (*) doesn’t somebody want this guitar.. like I think people would (*) want to be playing it..like family
225,228,Jeans,like June Carter.. you mean like what June Carter you mean?
227,234,Lily,some families though don't have that.. I mean like you know somebody has Tommy Geralds fiddle his family is disaster 
233,235,Mae,I bet that guitar sounds pretty amazing
237,238,Lily,stop look and listen (***)
239,240,Jeans,here but wait
240,241,Lily,custom design..what's this? 
244,245,Jeans,oh yeah yeah this way the second floor
246,249,Jeans,it’s knowing that your bath is all...opening (****)
247,248,Lily,design your own..
248,251,Blake,Adhir come on you have to see all of them!
250,251,Jeans,so stupid
254,255,Jeans,retarded...k where is he...GOD
255,257,Adhir,It's hard for me to leave this 
256,258,Blake,well just look at that (*) 
257,261,Adhir,this is the closest I'll ever get to Hank Williams! his real guitar
261,262,Lily,what's going on?  (*)
263,264,Jeans,come on let's keep going
265,268,Adhir,having a moment for Hank Williams..
267,268,Lily,awww
268,270,Adhir,just like he lived a really sad life 
268,270,Jeans,look at these Blake..here come here
269,272,Blake,I KNOW! I KNOW!! I know about the records..silvers like over a million..gold is
269,270,Lily,I know
270,275,Adhir,I won't ever go to his grave.. but this is a chance for me to just.. be near his guitar
273,276,Jeans,Blake it doesn't matter! Blake you don't need to.. stop.. wait oh look here's Johnny Cash's two million!!
277,278,Lily,Twenty nine!
279,283,Adhir,so sad he had like.. women use him and 
281,282,Lily,I know 
283,285,Adhir,and for fame 
284,285,Lily,I know
285,287,Adhir,addicted to everything 
287,289,Lily,painkillers right? for his back
289,292,Adhir,yea and alcohol to..yea that's right! I think 
291,293,Lily,he had back problems
292,295,Adhir,he had like scoliosis or something yea something 
295,299,Mae,but you gotta..you gotta go see Bill Monroe's mandolin.  
296,297,Jeans,wow!
298,299,Adhir,k let’s go
300,302,Blake,look at this right here (*)
301,305,Jeans,there's a record over there..you guys there's a record over there that sold over eight million copies (*)
302,303,Adhir,WOA!
305,306,Lily,wow
308,310,Adhir,OH MY GOSH!
310,311,Jeans,isn’t that insane
314,318,Adhir,he must have just wailed on it to get that pickguard.. that big
317,320,Jeans,yea.. well.. it’s also that’s a different kind of a
319,321,Adhir,I’ve never seen a pickguard like that
322,323,Blake,me neither (5
323,324,Blake,LOOK it Earl Scruggs Banjo (5
325,329,Adhir,Earl Scruggs Banjo..the most famous banjo in the world just chilling
330,333,Blake,AND THEN BILL MONROE’s mandolin which got put together by a hundred fifty
332,333,Adhir,say what
333,334,Blake,Bill Monroe’s mandolin
334,335,Adhir,ahh yeah
335,345,Blake,150 umm splinters of wood..PERFECT LOOK AT IT..there’s not a single..like there’s like...some like...look it...it looks like it was never
337,339,Jeans,maybe they’ll have new posters in the museum today.. the shop (5
342,344,Mae,I don’t think you would get your hopes up about something like that
346,348,Adhir,ahh you can’t even tell it was repaired!
346,349,Jeans,you told me I wasn’t going to be able to get that poster home and I did.. it’s in a hard cardboard thing
347,350,Blake,like NOTHING...they did such a good job on doing that..crazy!
356,358,Blake,and then Maybelle Carters and ummm Hank..wait...Jimmy Rogers
363,365,Jeans,isn’t this just on recording stupid stuff!?
369,370,Jeans,what’s that?
377,382,Lily,it doesn’t work!  i wanna see this one! It's not it!
382,383,Blake,there
397,399,Jeans,god he goes SO SLOW
398,399,Lily,oh LOOK! Hank Williams
400,401,Jeans,oh yeah
405,408,Jeans,look at the grammies no wait (**) it's a
415,416,Jeans,that’s epic look at that
416,418,Lily,that’s beautiful!
416,417,Blake,Maybelle Carter’s...Gibson L-5
417,418,Adhir,WOW! Maybelle Carters guitar
419,420,Jeans,so cool (6
420,422,Blake,and then Jimmy Rogers and that’s all
421,424,Adhir,NINETEEN YEARS OLD!
422,424,Blake,that’s still pretty old
426,430,Adhir,that’s not that old?  she paid 275 DOLLARS!
429,432,Blake,back then that was a lot
431,434,Adhir,yea.. back then that was so much money
440,443,Mae,she changed the WORLD with that guitar
442,443,Adhir,YEA!
444,447,Mae,so CRAZY she had more influence than probably any of these guys (*)
450,455,Jeans,imitated..she.. it became the most imitated guitar sound in America during the 20’s and 30’s (***)
462,466,Mae,just a true creative force arising out of nothing.. it’s just so cool
466,467,Jeans,let’s keep going!
469,470,Lily,let’s go down-where do we go now?
470,471,Adhir,OH MY GOD!
470,471,Jeans,we come over here
472,474,Lily,I think we can skip crystal gayle
474,477,Jeans,yea of course!  come on you guys
475,476,Lily,LOOK at those dresses
477,478,Adhir,it’s in such good shape to!
478,479,Adhir,it’s pretty impressive
478,480,Mae,I know
480,483,Jeans,Look you won’t even believe all the platinum gold records on this place...HUNDREDS!
481,483,Blake,YOU DIDN’t look at Jimmy Rogers!
482,485,Adhir,yea Jimmy Rogers I don’t know.. I never really liked him that much 
486,489,Blake,oh yeah now we are going down to the second floor (**) where there’s smokey and the bandit car
488,489,Adhir,ok
490,492,Blake,the best movie in the world