start,end,speaker,content
2735,2737,Single student,Because there was so many people //who were just diving to get in a car.
2736,2738,Single student,//Your name's right there.
2738,2740,Teacher,"Oh, I'm sure. Yeah. Supply and demand."
2740,2742,Single student,"They just, like-"
2742,2744,New student,"I drew variable direction. Like, what do you put for variable direction?"
2745,2747,Teacher,Variable direction? I think I answered that a few minutes ago.
2748,2750,New student,I thought you answered variable speed.
2749,2751,Teacher,"What did I say about variable direction, Wes?"
2752,2754,New student,Pardon?
2753,2755,Teacher,What did I say when the direction is variable?
2755,2757,Single student,It can go any- you can just point the arrow in whatever way you want it to.
2759,2761,Teacher,Just put a line on there somewhere to attach your five miles per hour. 
2766,2768,Teacher,There you go. There you go.
2773,2775,New student,Do we have to use different colors?
2775,2777,Teacher,"No. Uh-uh. No. Not on the station model. The whole thing can be the same color. When you shade, if you want to use color, you can use color. "
2783,2785,Teacher,Okay. It's just like shading when you did the station model worksheet.
2787,2789,Teacher,How are you doing over here? 
2788,2790,New student,Good.
2789,2791,Teacher,You get it?
2790,2792,New student,Yeah.
2791,2793,Teacher,Good. 
2793,2795,Teacher,"How many you got done, Mitch?"
2794,2796,New student,"This thing is too big, but-"
2796,2798,Teacher,How many station models?
2797,2799,New student,"One, two, three, //four, five, six, seven."
2798,2800,New student,//Seven.
2800,2802,New student,Eight.
2801,2803,Teacher,"Eight? One, two, three, four, five, six, seven, eight. Okay. "
2807,2809,Teacher,Yes? Who's calling me? What?
2809,2811,New student,"Since Cape Hatteras is out in the ocean, where are we supposed to put it?"
2811,2813,Teacher,It isn't in the ocean.
2813,2815,New student,There's no dot.
2814,2816,Teacher,It is right- it's a cape so I'm assuming it's like right here. We'll just make it right there. There's the city. Now go with it. 
2824,2826,Teacher,It's not in the ocean.
2826,2828,New student,That's how they showed it on the map. 
2829,2831,Teacher,"Actually, I should show you the picture of the lighthouse that's there. "
2832,2834,Teacher,I'll pull that stuff out for tomorrow because it's kind of interesting.
2847,2849,New student,Where is Cape Hatteras?
2849,2851,New student,It's out in the ocean.
2850,2852,New student,I know but-
2851,2853,New student,It's in the middle of the ocean.
2854,2856,New student,It's the little dot. It's right there.
2857,2859,Teacher,"It's not in your book map. Oh. Yes, it is in your book map. It's not on the plastic map. It's right here."
2861,2863,New student,I know.
2862,2864,Teacher,It's- 
2863,2865,Single student,"I know, but it's-"
2864,2866,Teacher,You know? Why are you asking //me?
2865,2867,Single student,"//Well, it's like ""where do I put it?"""
2866,2868,Teacher,Okay.
2867,2869,Single student,I know because I had to go there.
2868,2870,Teacher,It- it should be like right here somewhere. Anywhere that it looks like it might- right in that little cove area there. 
2876,2878,Single student,There it is.
2877,2879,Teacher,"There- okay. I'll- to put it to you this way, there's a lighthouse on Cape Hatteras so it can't be back in that cove area, right? "
2885,2887,Teacher,It's got to be the most sticking out point of North Carolina. How's that?
2891,2893,New student,That's good.
2892,2894,Teacher,"Okay. But they had to move the lighthouse because the most sticking out point of North Carolina got washed away, and they thought //that they-"
2900,2902,New student,//So the original Cape Hatteras is in the ocean.
2905,2907,New student,"So wait, a continent got washed out to sea?"
2907,2909,Teacher,"Okay, Dorothy. You got me there. "
2909,2911,Single student,I'm confused.
2910,2912,Teacher,I can't- no. They actually rolled it back. It's very interesting.
2913,2915,Single student,//What?
2914,2916,Teacher,"//I'll find the stuff. You keep working, I'll find the picture. "
2916,2918,Single student,That confuses me.
2917,2919,Teacher,You just keep working. Just- 
2918,2920,New student,It's right here. That little part-
2920,2922,Teacher,It's that little part sticking out right there. 
2924,2926,Teacher,"Yeah, everything filled in. You're gonna have to wait for your group mates to figure out their stuff so //that you can move on to it, but-"
2929,2931,Single student,//So Rhode Island is floating up the sea?
2931,2933,New student,No. Rhode Island //is not an island- 
2933,2935,Teacher,"//Look at- look at where your cloudiness is; look at where your precipitation is and you can go ahead and shade that, "
2941,2943,Teacher,and then they're all gonna want to look at yours when they get done so they can copy it.
2944,2946,New student,Rhode Island is not an island.
2947,2949,Teacher,"Rhode Island is not an island, nope. They probably thought it was when they named it."
2962,2964,New student,Where is it anyways?
2963,2965,New student,Where is Rhode Island? 
2965,2967,New student,There is Iowa. 
2972,2974,New student,Rhode Island is-
2977,2979,New student,(If you see) Massachusetts (you see towards) Rhode Island- 
2980,2982,Teacher,"I'm really thinking we need an American geography class, you guys."
2984,2986,New student,"Oh, yeah."
2985,2987,Teacher,Yeah.
2988,2990,New student,Stop.
2989,2991,New student,"Oh, yeah. I see it now."
2990,2992,New student,When did you say it's Rhode Island?
2993,2995,New student,Let's (inaudible) Massachusetts.
2995,2997,New student,Isn't that the tiniest state?
3003,3005,New student,You got issues.
3019,3021,Teacher,"Uh, is there a problem? Do I need to be babysitting?"
3022,3024,New student,No.
3023,3025,New student,Yeah. You need to baby-sit them.
3024,3026,New student,Baby-sit them.
3025,3027,Teacher,"No, I don't think that's in my job description. "
3029,3031,Single student,Baby-sit (inaudible).
3032,3034,Teacher,Not when the kid being babysitted is 14 years old.
3039,3041,New student,That means it's not me because I'm not 14 years old.
3041,3043,New student,Neither am I.
3043,3045,New student,You baby-sit at 14?
3049,3051,Teacher,There it is.
3050,3052,New student,Miss Anderson?
3051,3053,Teacher,Uh-huh?
3052,3054,Single student,Is the higher the humidity where a high pressure is or low pressure?
3058,3060,Teacher,Hmm. Good question. Where would the most humidity be?
3062,3064,Teacher,"Think about- look at- well, think about a weather map. "
3070,3072,Teacher,Where is the precipitation around the fronts? 
3078,3080,Teacher,Precipitation is behind the front or in front of the front?
3080,3082,Single student,It's in front of it.
3082,3084,Teacher,"In front of the front. Okay. So if you're looking at precipitation, you're looking at humidity, too. "
3088,3090,Teacher,So what is higher humidity gonna tell you?
3095,3097,Single student,Precipitation.
3097,3099,Teacher,It's gonna tell you there's precipitation so where would it be located in relationship to the front?
3102,3104,Single student,By the precipitation.
3104,3106,Teacher,What will be by the precipitation?
3106,3108,Single student,The front.
3108,3110,Teacher,The front. What front?
3112,3114,Single student,Cold front.
3113,3115,Teacher,Very good.
3114,3116,New student,Where is Des Moines?
3116,3118,Teacher,It's not Des Moines. It is Des Moines.
3119,3121,Single student,Where is it?
3120,3122,Teacher,It's in Iowa.
3123,3125,New student,I read that book in art.
3125,3127,Teacher,Hmm?
3126,3128,Single student,I was looking through that book in art.
3127,3129,Teacher,Were you?
3128,3130,Single student,One of the last days.
3130,3132,New student,Is the bell going to ring late today?
3131,3133,Teacher,"You know what? I'm not sure. Jennifer, go ask Mrs. O'Brian if she is going to let everybody out for lunch by the bell or at nine minutes after."
3144,3146,New student,Okay.
3145,3147,Teacher,Okay? Okay. So far Jennifer is the only one that got all of the cities plotted.
3150,3152,New student,I'm almost done.
3151,3153,Two or more students,I'm almost done.
3152,3154,New student,Two more.
3153,3155,Teacher,Two more? You might finish if you don't talk.
3157,3159,New student,This is a- 
3158,3160,New student,I haven't been talking all day. 
3159,3161,New student,Yes you have.
3160,3162,New student,I get a lot of //energy when I-
3161,3163,New student,//(inaudible) I hate it.
3162,3164,Teacher,//Sit on your butt.
3163,3165,New student,I don't like this. I get a lot of energy when I don't talk. 
3166,3168,Teacher,You what?
3167,3169,Single student,I don't like this. I get a lot of energy when I don't talk.
3169,3171,Teacher,Tomorrow is gonna be even worse because you won't be allowed to talk in here either.
3172,3174,Single student,I'll be running around the whole- the whole lunch hour.
3176,3178,Teacher,"Mark, sit. Thank you. Work."
3179,3181,New student,We need the map.
3185,3187,New student,I got all the cities.
3186,3188,Teacher,"You got all the cities done? Okay. I told Jennifer to go ahead and- ooh, Cynthia, you went ahead of your group. "
3191,3193,Teacher,You're supposed to be making those decisions with your group together.
3194,3196,New student,Yeah but she- she wouldn't-
3195,3197,Teacher,"Okay. When you get to the point when you are ready to do precipitation and the fronts, decide as a group,"
3203,3205,Teacher,so that you can explain why you think the front needs to go somewhere and then someone else can either debate with you or agree with you. 
3210,3212,Teacher,And don't agree with the person just because they get better grades in science.
3216,3218,Teacher,Because a lot of times when it comes to this kind of stuff they won't get it. It happens an awful lot. 
3223,3225,Teacher,"They know the bookwork, they understand some of the concepts, but when it comes to actually applying them,"
3229,3231,Teacher,sometimes those people that really get good grades have a real hard time with this kind of stuff. Mitch?
3233,3235,New student,Is this homework?
3235,3237,Teacher,No. It is not homework.
3236,3238,New student,"Oh, good."
3238,3240,Teacher,I'm gonna give you one more minute to work and then I'm gonna explain the rest to you. What did she say?
3242,3244,New student,Nine after.
3243,3245,Teacher,Nine after? I figured she was gonna be going to lunch.
3246,3248,New student,So can we get out at the bell?
3248,3250,Teacher,"No. You'll get out before the bell. If you want to get out at the bell, it probably won't ring until a quarter after or so. "
3255,3257,New student,Oh. The bells are behind?
3256,3258,Teacher,The bells are behind. Because it would actually be ringing during the middle of- if we were following that clock during the middle of fourth hour. 
3264,3266,Teacher,It's that middle bell.
3267,3269,Single student,I don't like the fourth- the bell for fourth hour because there's no minute bell which is why I'm always late.
3272,3274,Teacher,You won't be today.
3273,3275,Single student,I know.
3274,3276,Teacher,"Because there will be teachers in the hallway making sure you make it, because you won't be talking to each other in the hallway. "
3278,3280,Teacher,It's actually working out quite nicely.
3280,3282,New student,"I feel like I'm in a state prison. I mean, //don't they-"
3282,3284,Teacher,//That's how we want it to feel.
3283,3285,Single student,About the only difference is that- is that the teachers aren't carrying 12 gauges.
3287,3289,Teacher,"No, we won't do that, but we are definitely- it is definitely a //crackdown situation."
3293,3295,New student,//You just keep hurting yourself.
3294,3296,New student,"Yes, I do, and it's not fair."
3296,3298,Teacher,Work.
3297,3299,Single student,I keep //(inaudible)-
3298,3300,Teacher,//Work.
3300,3302,New student,I have a question.
3301,3303,Teacher,Hm?
3302,3304,New student,How did this ever start anyways?
3303,3305,Teacher,Huh?
3304,3306,Single student,How did that start anyways?
3305,3307,Teacher,Last Friday's behavior.
3307,3309,Single student,(Mine)?
3308,3310,Teacher,No.
3311,3313,New student,Houston's in Texas.
3312,3314,Teacher,Who's done?
3314,3316,Teacher,"Oh, there's that lunch bell. Stop. Freeze. You are responsible to bring the map and the instructions back to this room-"
3323,3325,Other,Can you send Dorothy to the office?
3325,3327,Teacher,She is on her way.
3326,3328,Other,Thanks.
3327,3329,Teacher,"Tomorrow if you don't have it, am I going to give you another one?"
3330,3332,Two or more students,No.
3331,3333,Teacher,No. Are you going to get a grade?
3333,3335,Two or more students,No.
3334,3336,Teacher,No. Just so long as we understand that. Have a nice lunch.
3337,3339,New student,"You, too, Mrs. Anderson."
3339,3341,Teacher,"Make sure everything else is on the middle of the table. Don't- thank you, Jeff."
3342,3344,New student,Do you want your pencil back?
3343,3345,Teacher,"Yes, I want my pencil back. Put that on and leave it on. It's not working, Victoria."
3352,3354,New student,"See you tomorrow, Mrs. Anderson."