start,end,speaker,content
4,6,Teacher,"Okay. The bells are kind of messed up so we will- I will probably just go ahead and dismiss you. We're now starting like five minutes late,"
15,17,Teacher,because they didn't get the bells working right.
16,18,Teacher,"All right, who is absent? Anybody?"
19,21,New student,I don't know.
21,23,Teacher,You don't know? Do you know who sits at your table normally?
25,27,New student,//He's missing. Who is he?
26,28,New student,//I don't know who is supposed to-
27,29,New student,Devin is not here.
28,30,New student,No. He's //here.
29,31,Teacher,//Devin is gone.
30,32,Single student,He's here.
31,33,Teacher,Right. He's here.
35,37,Teacher,"Jennifer, I'm gonna have you move to-"
41,43,Teacher,"Yeah, a table of three people, not the one that's got four. "
46,48,Teacher,"All right, so nobody is absent? Everybody is here?"
49,51,New student,Yeah.
52,54,Teacher,Okay. 
57,59,Teacher,"Um, I'm not going to return your papers today. I'll save that for tomorrow. We'll get right into what we're going to be talking about today. "
66,68,Teacher,There's just a couple of things that I needed to go over with you first that I'm not sure that you got it before. 
76,78,Teacher,Yes? Writing your homework books? Okay. 
84,86,Teacher,All right. Open up your book. What? 
88,90,New student,I can't hear out of my ear.
90,92,Teacher,What's wrong?
91,93,Single student,It hurts.
93,95,Teacher,Did you ever go to the doctor?
95,97,Single student,Yeah.
96,98,New student,"Miss A, (inaudible)."
97,99,Teacher,What?
98,100,New student,(inaudible).
99,101,Teacher,Okay. Take these right here. Go. Bye. They must feel like they have the plague or something.
108,110,Teacher,All right. You ready?
110,112,New student,Yeah.
111,113,Teacher,Okay. On page- open your book to page 588. 
114,116,Teacher,There are- 
123,125,Teacher,There are some weather maps. There's actually four weather maps on those pages that are in front of you. 
128,130,Teacher,"They are showing a progression of weather over a four-day period? Three-day period, okay. Where the weather is going. "
139,141,Teacher,"Looking at those four maps, looking at the one on the page before that- flip one page back- "
151,153,Teacher,"Okay? And looking on the page after that- flip two pages, forward- "
160,162,Teacher,"So you're looking at page 587, 88, 89, and 90- find the high pressure centers; "
175,177,Teacher,"find the low pressure centers,"
180,182,Teacher,"on any one of those five or six maps,"
184,186,Teacher,find the cold fronts and the warm fronts. 
190,192,Teacher,"Okay, now here's a puzzle for you. What do you notice about fronts and pressure centers?"
198,200,Teacher,What do you notice about the fronts and the high pressure; and the fronts and the low pressure?
204,206,Teacher,Look- and you gotta look at the map in order to answer the question.
209,211,Teacher,"And if you can't figure it out with one map, move to another map."
215,217,Teacher,Make some comparisons.
218,220,Teacher,What pattern do you notice about fronts and pressure centers?
233,235,New student,I have a question.
234,236,Teacher,"Mm. No- no, no. I'm waiting."
238,240,New student,I have a question.
239,241,Teacher,Oh. Question? Okay.
240,242,Single student,Aren't the pointed ones the warm fronts?
243,245,Teacher,The pointed ones are the cold fronts.
245,247,Single student,Okay. I was just making sure.
250,252,Teacher,"I thought you were gonna answer the question. I am waiting for some people to get that look on their face, like, ""oh."" "
262,264,Teacher,"Stuart, are you noticing anything?"
268,270,Teacher,Is there something you're noticing about the high pressure centers that is not the same as the low pressure centers?
281,283,New student,Besides the- besides the points?
284,286,Teacher,Besides the what?
285,287,Single student,"The points, the triangle-"
286,288,Teacher,What about the points?
288,290,Single student,That there's like more(inaudible)-
291,293,Teacher,There's no triangles where?
293,295,Single student,No. There's more triangles-
294,296,Teacher,Oh.
295,297,Single student,Than there's (inaudible).
297,299,Teacher,Oh. Okay. So there's more cold fronts than warm fronts?
300,302,Single student,Yeah.
300,302,Teacher,"Okay, but what about the low pressure centers and what about the high pressure centers? "
315,317,Teacher,"Mitch, what do you think?"
316,318,New student,I think that there's low pressure centers on the cold fronts and the warm fronts too. Like on a front //there's like a-
323,325,Teacher,//And what about the high pressure centers?
325,327,Single student,They are moving away from the front.
328,330,Teacher,"They don't seem to have fronts attached to them, do they?"
332,334,Single student,No.
333,335,Teacher,"You notice that, Jeff?"
334,336,New student,Uh-huh.
335,337,Teacher,Look at all the low pressure centers. Do you see fronts attached to them? 
339,341,Teacher,"No. Can you tell me why? Remember the balloon thing? Can you tell me why? Jeff, what do you think?"
349,351,Single student,"Uh, when it hits the hot air, it would like go above it. Like-"
356,358,Teacher,So you got a warm air mass and a cold air mass?
358,360,Single student,"Yes. And when it hits- I remember, but- I remember it, but it's hard to explain."
365,367,Teacher,Okay. You're saying the warm air rises above that cold air?
369,371,Single student,Yes. 
370,372,Teacher,Okay. 
371,373,Single student,And the-
374,376,Teacher,And the warm air has what kind of pressure?
378,380,Single student,Low pressure.
379,381,Teacher,"Okay. Mark, did you have something to add?"
381,383,New student,No. I was gonna say (inaudible).
384,386,Teacher,"Okay. Let me show you a real easy way to really kind of understand it. I have three balloons this time, and they are different color. Red is?"
394,396,New student,Cold.
395,397,Two or more students,Warm.
396,398,Teacher,Warm air. Blue is?
397,399,Two or more students,Cold.
398,400,Teacher,"Cold, and yellow is?"
399,401,Two or more students,Warm.
400,402,Teacher,Is cooler. Let's say cooler. All right. Let's look up here for a second. 
407,409,Teacher,"And you'll even notice on this map there aren't any fronts attached to those low pressure centers, right? "
412,414,Teacher,"Just- or to the high pressure centers. Just to the low pressure centers, right? "
416,418,New student,Uh-huh.
417,419,Teacher,Okay. So where would the red balloon go? If this is the- what kind of front?
423,425,Two or more students,Cold.
424,426,New student,Cold front.
425,427,Teacher,Then where's the warm air going to be?
427,429,Two or more students,Going behind it.
428,430,Teacher,Behind it? This is the front of a warm air mass?
432,434,New student,"Uh, no. It's gonna be in front of it."
433,435,Teacher,It's gonna be in front of it?
434,436,New student,Yeah.
435,437,Teacher,Okay. Where's the cold air gonna be?
437,439,Entire class,Behind it.
438,440,Teacher,"Behind it. And we'll put the yellow air up here, okay? This is where the low pressure center happens. Watch what happens. "
445,447,Teacher,Here's the warm air. Here's the cold air. Here's the cool air. You see the hole in between the three?
451,453,Entire class,Yeah.
452,454,Teacher,"There's your low pressure center. It's where those big bubbles of air have a depression, or an area, a gap, that space, "
462,464,Teacher,that's the low. See? Yeah.
465,467,Two or more students,Yeah. 
466,468,Teacher,"Ah. Okay? That's what you're looking at. You're looking at that bubble of warm air, the bubble of cold air behind. "
473,475,Teacher,"Here's the front right here, right? The front of the air mass, yes? "
477,479,Teacher,"And then where they all meet up- where these bubbles of air meet up, that's where that low pressure center comes in. "
484,486,Teacher,The high pressure is going to be this big bubble of cold air at the very highest point of it as far as pressure goes. 
494,496,Teacher,"It's not gonna ever have a front because it occurs in like the middle of the air mass, okay? "
500,502,New student,Okay.
501,503,Teacher,Get it?
502,504,New student,Yeah.
503,505,Teacher,Ooh. Yes?
504,506,New student,So then basically a tornado would be caused because of low pressure in the (inaudible)?
510,512,Teacher,"Yes. That depression of low pressure air, right. What you got is air funneling in and air funneling up at the same time, "
519,521,Teacher,"and then once it starts to twist- when we see that video on ""Understanding Weather,"" "
523,525,Teacher,it's really cool because it shows the air funneling like this on the ground. What's that called?
531,533,New student,Conven- 
532,534,New student,Convection current.
533,535,Teacher,"Right. It shows that on the ground like a big tube doing that, and then when that- I think it showed cold air- hits it- excuse me- hits it, "
543,545,Teacher,it- remember when I said the cold air hits that blue and the blue goes flying off- or the-
548,550,New student,Uh-huh.
549,551,Teacher,Cold air hits the red and the warm air goes flying up? That's what causes the storm? 
553,555,Teacher,"What it shows is that that tube gets split and splits up this way, and that's the beginning of a funnel cloud. It's very cool. "
562,564,Teacher,"But you'll see that on the, uh, video. Okay. So does that help with low pressure and high pressure and-"
568,570,New student,Yeah.
569,571,New student,//Yeah.
570,572,Teacher,//Okay? Kind of a visual.
571,573,New student,Uh-huh.
572,574,Teacher,Okay. The reason you need to know that is because this is what you are going to be doing. 
576,578,Teacher,First hour did not even finish the cities on their map which was kind of disappointing. I thought they'd get further than that. 
584,586,Teacher,"You do not need- and I won't let you use- your book or your notes. I was going to let you, and then I thought, "
592,594,Teacher,"No, I think that you need to get that station model plugged into your head a little better than you have it. "
598,600,Teacher,"Okay? So you don't need any of that. You may use the map on page 770, I think. Check page 770 in your book. "
613,615,Teacher,"There should be, yep, a map of the United States. You also have a map like this at your table with all of the cities on it. "
621,623,Teacher,Oh. They don't have one down there. 
623,625,Teacher,"Hannah, would- would you take that map down to the office and ask them to give it to the kids inside the conference room?"
632,634,New student,Okay.
633,635,Teacher,"Okay? I think they brought the map back from their- and then tell them to leave it there. Leave the pencils and the map, okay?"
640,642,Teacher,"All right, so you've got enough reference for finding certain cities. You're going to get a list of 12 cities in the United States."
648,650,Teacher,"Oh, that stays on; this goes off."
649,651,Teacher,"A list of 12 cities in the United States, with some other data. I told you this last week."
656,658,Teacher,And you're going to get a blank map that- handing out?
662,664,New student,(inaudible)
663,665,Teacher,Okay. Handing out?
666,668,New student,Here. (inaudible)
667,669,Teacher,Yeah. Dorothy.
668,670,Teacher,"I want to let Dorothy do it, because she threw her hand out there first. I didn't think she wanted to get up, but she does."
674,676,Teacher,"Okay. You're gonna get a sheet like this, that has all of the instructions that you need on it."
679,681,Teacher,"What you are going to do is, on the map, in front of you- and put all your notes away right now-"
685,687,Teacher,"any notes, any... You can only have your book open at page 770."
705,707,Teacher,"Okay. On the blue sheet is a list of the 12 cities, around the country. You might wanna make note that-"
715,717,Teacher,"Hatteras, fourth from the bottom, is actually called ""Cape Hatteras""; "
722,724,Teacher,"most of you have probably never heard of it. You will, though, by the time we get done with oceans."
727,729,Teacher,It is in North Carolina. North Carolina.
733,735,Teacher,I'm not gonna show you where that is; you ought to know where North Carolina is.
737,739,Teacher,"And, uh, Kansas City. There are two big Kansas Cities. We're talking about- thank you- Kansas City, Missouri. Okay?"
746,748,Teacher,"So you might wanna write ""MO"" after Kansas City, just so you remember where it's from."
759,761,Teacher,"All right, who wants to read the directions? I'm gonna stop you a lot as you go through, and explain certain things."
764,766,Teacher,"Mark, go ahead."
765,767,New student,Locate and label each of the above cities on the attachment.
769,771,Teacher,"Okay. The first thing you're going to do is find the cities, one at the time. Detroit, okay?"
775,777,Teacher,"When you find it on the map, you're gonna put the little dot where Detroit goes."
782,784,Teacher,"Then you're gonna write ""Detroit,"" but you've got to write small, and you've got to write neat, so that I can read it. "
789,791,Teacher,"Stuart, you haven't started yet, have you?"
790,792,New student,No.
791,793,Teacher,"Don't, because I- I've got to tell you the whole thing. "
795,797,Teacher,"Remember where Detroit goes on a station- a weather station model, right? "
802,804,Teacher,"Many of you forgot to put ""Weather City"" when you had to redo another station model on that worksheet. "
808,810,Teacher,Lots of people did not put that city name. They put all the other stuff but didn't put the city. 
813,815,Teacher,"So when you write ""Detroit,"" to the left of it make your circle right away and start building that station model."
823,825,Teacher,"Otherwise, if you go through and write all the cities first, then you're gonna have to go back and make sure you've got room to put the station model. "
831,833,Teacher,"So do one city at a time, okay? Do you know what I'm saying? "
834,836,New student,Uh-huh.
835,837,Teacher,You got it? Yes?
836,838,New student,(inaudible)?
837,839,Teacher,Like this. I'll just start this first one just so you know. 
840,842,Teacher,"If you have got this part of Michigan right here, and you put the dot, you need to write ""Detroit"" over here, okay? "
851,853,Teacher,And then start your station model right here.
855,857,Teacher,All right? A reminder that the wind direction is that arrow to the middle.
862,864,Teacher,All right? And- I'm trying to think what else they had trouble with. They had a little trouble last hour with cloud coverage in the circle. 
872,874,Teacher,"If you're not sure, ask someone at your table first before I come around to help you with that. Make sure you get it before- "
878,880,Teacher,"or somebody else- you've asked somebody else before you ask me, okay? "
883,885,Teacher,"Because you had the 25%, you had the 50%, and you had the 75% then you had full coverage. "
888,890,Teacher,"Remember what those meant because that's how they are on this sheet, okay? Okay. So there's your- any questions on the station model? "
899,901,Teacher,"You know where everything goes on there? There are only two cities with current conditions, and I'll put the symbols on the board. "
904,906,Teacher,"They're very simple, okay? So you don't need that chart either. Okay. Next one. Mark, keep going."
912,914,New student,Construct a weather station map for each of the above cities. Place them at approximate locations.
918,920,Teacher,Appropriate locations. 
920,922,Single student,//Oh.
921,923,Teacher,"//Yep. All right. Now, that's as far as everybody got for second hour, okay? Go ahead and read on, Mark."
928,930,Single student,Place high and low pressure centers where you think that- where you think they would be located on the map. 
934,936,Teacher,You're gonna have to look at what in order to do that? What's some indicators of high and low pressure? 
942,944,Teacher,"Oh, no. You know what we thought of last hour? Don't do this one. Put an arrow, four, five, and five to four. "
949,951,Teacher,"Do step five first. It'll make four a lot easier. Or three and four. I'm sorry. I'm sorry. Wait, wait, wait. "
956,958,Teacher,"Do step four first and then go back up and do step three. Read step four, Mark, so I can explain what I mean there."
966,968,Single student,Shade regions of precipitation. Place symbol for cold and warm fronts where they would most- most likely be located on the map.
976,978,Teacher,Okay. Do you see why I said to do this one first?
979,981,New student,Uh-huh.
980,982,Teacher,"When you find the areas of precipitation and then you find the cold and warm fronts, "
985,987,Teacher,"it should be a lot easier to put the low pressure and high pressure centers, right? Okay. "
990,992,Teacher,So do number four first and then go back and do number three. When you shade for precipitation: 
999,1001,Teacher,"if it's light rain, it's a light green; if it's medium rain, if they just say rain, then it's a yellow; and if it's a thunderstorm, then it's red. "
1009,1011,Teacher,"That's how the Doppler Radar satellite picture picks it up, okay? It's the density of the air is what they pick up, all right?"
1017,1019,Teacher,"Okay. Go ahead, Mark."
1019,1021,New student,Answer the following questions. Interpret the data using your (map weather). 
1025,1027,Single student,Explain the locations of high and low pressure centers in warm and cool fronts. 
1031,1033,Single student,Are there any environmental or severe weather incidents that may occur? Include the weather indications in the map. 
1040,1042,Single student,Use your weather map to explain the above answer.
1044,1046,Teacher,Okay. This will be on a separate sheet of paper- probably won't get it until about the middle of class tomorrow-
1050,1052,Teacher,"where now you have to explain why you put everything on your map where you put it, okay? "
1056,1058,Teacher,"So you're kind of explaining yourself: low pressure, high pressure. And hopefully you'll be able to do that. "
1062,1064,Teacher,"I think you can, if you allow yourself to think in that direction. Okay, and then six."
1070,1072,Single student,"Using the data on the weather, forecast the weather for October 24th, 2002, for each of the cities of the (inaudible)-"
1078,1080,Teacher,Okay. Are there any questions about what I expect you to do? No? 
1086,1088,Teacher,So I will be able to just sit here the whole time you're doing this and just watch you like last hour? Todd?
1095,1097,New student,"I don't get shade regions of precipitation."""
1099,1101,Teacher,"Okay. On the map that you had to do for the weather station models, they told you to shade the areas of precipitation. "
1106,1108,Teacher,The same way that this map did- you see how they shaded these areas? Where it's raining. 
1114,1116,Teacher,"And once you get done with all your station models, you'll be able to see it better. "
1117,1119,Teacher,"You'll look for the cloudy areas, and then from that you'll look for the rainy areas."
1120,1122,Single student,"Now I know, I just- I thought you meant to do four completely first."
1126,1128,Teacher,"No. No. Well, yeah. You're gonna do four first before you do three."
1130,1132,Single student,"I know that, but I thought-"
1131,1133,Teacher,"Oh, no. Not before two though, right. Okay. Got ya."
1134,1136,Teacher,Jeff?
1135,1137,New student,Do you work as a group or-
1136,1138,Teacher,"You work as a group, yes."
1137,1139,Single student,Okay.
1138,1140,Teacher,"Which means talking quietly about the mapping activity, not about what you did over the weekend, okay?"
1147,1149,Teacher,"Yes, Wes?"
1148,1150,New student,"I'm really not sure about these, uh, models we have to put down."
1153,1155,Teacher,Okay.
1154,1156,Single student,I don't quite understand them.
1155,1157,Teacher,Did you do that worksheet last week?
1157,1159,Single student,Which one?
1158,1160,Teacher,The one that you were supposed to turn in for a grade on Friday. 
1161,1163,Single student,I'm not sure.
1162,1164,Teacher,"You had ""weather city"" and then ""around the circle"" which had cloudiness in it."
1170,1172,Single student,I don't remember anything like that. I remember most of last week.
1174,1176,Teacher,"All right, I'm not sure you turned it in. "
1176,1178,Single student,I'm not sure either.
1177,1179,Teacher,Okay. We'll see what your group can help you with.
1181,1183,Single student,Okay.
1183,1185,Teacher,Jeff?
1184,1186,New student,I was wondering if I could move right next to Geoffrey so we-
1187,1189,Teacher,Sure. Mark?
1189,1191,New student,"When we're like doing Detroit, you said- do you want us to write- "
1192,1194,Single student,"like go through and write all the cities and then go and do the weather stations, or do the city and then the weather station?"
1198,1200,Teacher,Somebody want to answer Mark's question?
1201,1203,New student,Do the weather- the city and the weather station together.
1203,1205,New student,Okay.
1205,1207,Teacher,"Don't go- don't do all the cities first and then go back and do the stations because you might write the name of the city in the wrong place,"
1212,1214,Teacher,and you won't be able to fit the weather station around it. Hannah?
1215,1217,New student,"Okay. What do we do for, like, the current conditions?"
1221,1223,Teacher,Okay. There are only two. Thanks for that. There are only two. Let me pull this up. 
1228,1230,Teacher,"They call it on those dir- and that's actual data information from last Wednesday, the 23rd, straight off the Weather Channel. "
1237,1239,Teacher,"When you're all done, I'm going to give you the actual satellite map with the warm fronts and cold fronts and high and low pressures. "
1244,1246,Teacher,You're gonna compare that to what you came up with on your map. I'm looking at probably Wednesday by the time we get to that. 
1253,1255,Teacher,Then you're- you're gonna forecast at the bottom. Your last step is gonna be a forecast. 
1257,1259,Teacher,"Then you're gonna look at what happened the next day and see how well your forecast came out, okay? "
1262,1264,Teacher,"Uh, but on the Weather Channel, instead of calling it intermittent rain, they call it light rain. So this is the symbol for light rain. "
1271,1273,Teacher,"I know it's tough, and I don't know if you're gonna be able to remember it, but that's light rain, okay? "
1278,1280,Teacher,"There are no thunderstorms, none of that, all the fancy stuff they had on that chart. And guess what this is?"
1284,1286,Two or more students,Snow.
1285,1287,Teacher,Light snow. 
1287,1289,Teacher,"If it were heavy snow, there would be two of them. Oops. Okay? "
1295,1297,Teacher,"Any other questions? Yes, Wes?"
1299,1301,New student,"So if it was heavy rain, there would be two //little footnotes?"
1302,1304,Teacher,"//Two dots, yep. Yep."
1305,1307,New student,Can I have a pencil? I only brought a pen.
1308,1310,Teacher,"Yeah. If you need a pencil, let me know. Don't try to do this in pen. It's too- too much erasing going on. "
1314,1316,Teacher,"Yes, Mitch? Question?"
1317,1319,New student,"When we shade these, what colors did they- do you want us to have them?"
1321,1323,Teacher,I have a box of pencils right up- colored pencils. I did. Right up here. Whatever color you want except red or blue. 
1329,1331,Teacher,Oops. You needed this. 
1332,1334,Teacher,"Whatever color you want except red or blue, okay? All right. If there are no more questions, get started. "
1341,1343,Teacher,I'm gonna put this away so I don't trip on it. 
1349,1351,Teacher,Yes?
1350,1352,New student,I need a pencil.
1351,1353,Teacher,"Okay. Go back over there and get one from where I got it, top- that little top drawer. Mark, did you have a question?"
1357,1359,New student,I don't like sitting next to a wall.
1359,1361,New student,(inaudible)
1360,1362,Teacher,Why?
1361,1363,New student,(inaudible)
1364,1366,Teacher,On the wall? Do you want me to move you up here? 
1368,1370,Single student,"No, that's all right."
1369,1371,Teacher,Oh. I thought so. Christina?
1371,1373,New student,Can I sharpen my pencil?
1372,1374,Teacher,"Yes, you may sharpen your pencil."
1374,1376,New student,"Can I sharpen my pencil, too?"
1376,1378,Teacher,Yeah. You guys are supposed to do this beforehand. 
1386,1388,Teacher,"Okay. Let's see if I can talk you through this. You wrote ""the city of Detroit."" "
1391,1393,Teacher,"And then there was a circle next to it so just draw a circle, a relatively large circle. "
1400,1402,Teacher,Okay. Now- no. Don't fill it in. Just a //circle.
1401,1403,New student,//Oh.
1403,1405,Teacher,"And I just said ""use a pencil."" Is that a pencil?"
1405,1407,Single student,Yes.
1406,1408,Teacher,"Oh. That's a cool pencil. Okay. An open circle. Now, in the circle you have four choices. "
1417,1419,Teacher,"These are your choices: mostly sunny- no. Clear, mostly sunny, partly cloudy, mostly cloudy, cloudy. That's it. Five of them. Okay? "
1429,1431,Single student,"That would be cloudy, wouldn't it?"
1430,1432,Teacher,And they are- it's saying cloudy. And they are represented by how much you shade that circle. 
1437,1439,Single student,So that would be about 50% probably?
1438,1440,Teacher,"Actually, cloudy is gonna be all shaded. "
1441,1443,Single student,Okay.
1442,1444,Teacher,Okay? 
1444,1446,Teacher,"And let me see your pencil for a minute, and I'll draw them on the back so you can- all right. "
1449,1451,Teacher,This one is totally unshaded so that's going to be what?
1454,1456,Single student,"Uh, sunny. "
1455,1457,Teacher,Clear. Yeah. Sunny or clear. This one is gonna be a quarter shaded. 
1460,1462,Teacher,This one is gonna be- let's do them all first and then you can compare. This one is gonna be this way. 
1469,1471,Teacher,And that one is gonna be completely- and you know this one's cloudy and this one's clear. 
